track_id,track_name,track_artist,lyrics,track_album_name
00ReeHCY0FQUyuAUyPJdnk,Ain't No Future In Yo' Frontin',MC Breed,"Intro : (Flavor Flav) To the beat Ya'll Ah yeah(Ya don't stop) Sound good to me This sound hard, somethin' funky people gon' dance to Give the record a second and a chance to Hittin' people like a scene of amazement While they slippin' back, my feet is planted in the pavement Crumble I can never do So now I'm lookin' dead at you What are you gonna do? You listen to the knowledge of a scholar You say ""How Breed?"" tell em how I holler I'm the E Double, and I proclaim my name Straight up good game, peeps all game I'm like a rhino runnin' through the roughest pack They figure I'm a trigga-happy nigga, so they step back Breed, the microphonist Boot last the longest The noose's the strongest It ain't a game, that's plain to see You listen to the sounds of Breed (and the DFC) There ain't no future in your frontin' I never got caught with a kilo And if you ever do, yo, it will never be with me, yo Servin' in a Cherokee or maybe it's a GTO Black-on-black Benzo, I get it at Never have to worry bout my posse gettin' jumped Cause if we ever do, yo TB, pop the trunk Cause we don't go for playin', when I play go grab a ball When I'm on the mic I ain't for playin', not at all Cause I clock 10 g's a week boomin' at my peak Always seek E sober, but I do get geeked I can give you a job, a place to eat hearty Meet your homeboy Marty at a b.o.b. party Takin' over, barkin' like a dog named Rover (woof!) I'm pickin' suckers like a four-leaf clover They're bitin' lyrics on the mic, I diss these cobras So now they're sayin', ""Eric Breed is gettin' over"" There ain't no future in your frontin' Ha-ha-ha There ain't no future in your frontin' I'm the B, the r to the double e-d and Down with my homie G-a-s and O.E. and Suckers causin' static, cause they still be disagreein' I don't give a - cause I'm from F-l-i-n-t'n A city where pity runs low If you ever shoot through my city, now you know Cause we are strictly business and we also got our pride And if you don't like it, I suggest you break wide Suckers steady lookin' for the m-o-n-e-y and Thinkin' that illegal is the best way, so they dyin' I ain't got time to see a fiend fiend out To give up all his money, and he givin' what he got That's the way I am, MC Breed cannot be different Never change my ways for the world or the government If I was the president, then I would state facts You leave it up to me, I paint the white house black It ain't no future in your frontin' There ain't no future in your frontin' Yeah, I got dollars in my pocket, not from rollin'If I was a fiend, then my gold would be stolen Put my name Breed on everything I own And when I get my jeep I'm puttin' 'Breed' on the chrome Shine it up good, kickin' through my neighborhood Motorola phone, fat rims and a Kenwood Quick to get around it, and then I'll have it drop Simply cause I'm ridin' people think I'm sellin' rocks But ain't no future in your frontin' Yo Flash man, drop that, man Won't you drop that (Keep on) (To the beat ch'all) Cruel to the rules of the world Live my life raw, cause I never liked the law Wear top tens, on my ass use jeans Sellin' big 8ths and tit-for-tat to the fiends Clock much dollars, but I never break a sweat Time to move out, my posse sayin' (bet) You got my back, and I got yours What time is it? Hm, Tear down the doors Man There ain't no future in your frontin' Never was, cuz There ain't no future in your frontin' Hey man, let's start this party up, right?(Beat y'all) (Keep on) Intro : (Flavor Flav) To the beat Ya'll Ah yeah(Ya don't stop) Sound good to me This sound hard, somethin' funky people gon' dance to Give the record a second and a chance to Hittin' people like a scene of amazement While they slippin' back, my feet is planted in the pavement Crumble I can never do So now I'm lookin' dead at you What are you gonna do? You listen to the knowledge of a scholar You say ""How Breed?"" tell em how I holler I'm the E Double, and I proclaim my name Straight up good game, peeps all game I'm like a rhino runnin' through the roughest pack They figure I'm a trigga-happy nigga, so they step back Breed, the microphonist Boot last the longest The noose's the strongest It ain't a game, that's plain to see You listen to the sounds of Breed (and the DFC) There ain't no future in your frontin' I never got caught with a kilo And if you ever do, yo, it will never be with me, yo Servin' in a Cherokee or maybe it's a GTO Black-on-black Benzo, I get it at Never have to worry bout my posse gettin' jumped Cause if we ever do, yo TB, pop the trunk Cause we don't go for playin', when I play go grab a ball When I'm on the mic I ain't for playin', not at all Cause I clock 10 g's a week boomin' at my peak Always seek E sober, but I do get geeked I can give you a job, a place to eat hearty Meet your homeboy Marty at a b.o.b. party Takin' over, barkin' like a dog named Rover (woof!) I'm pickin' suckers like a four-leaf clover They're bitin' lyrics on the mic, I diss these cobras So now they're sayin', ""Eric Breed is gettin' over"" There ain't no future in your frontin' Ha-ha-ha There ain't no future in your frontin' I'm the B, the r to the double e-d and Down with my homie G-a-s and O.E. and Suckers causin' static, cause they still be disagreein' I don't give a - cause I'm from F-l-i-n-t'n A city where pity runs low If you ever shoot through my city, now you know Cause we are strictly business and we also got our pride And if you don't like it, I suggest you break wide Suckers steady lookin' for the m-o-n-e-y and Thinkin' that illegal is the best way, so they dyin' I ain't got time to see a fiend fiend out To give up all his money, and he givin' what he got That's the way I am, MC Breed cannot be different Never change my ways for the world or the government If I was the president, then I would state facts You leave it up to me, I paint the white house black It ain't no future in your frontin' There ain't no future in your frontin' Yeah, I got dollars in my pocket, not from rollin'If I was a fiend, then my gold would be stolen Put my name Breed on everything I own And when I get my jeep I'm puttin' 'Breed' on the chrome Shine it up good, kickin' through my neighborhood Motorola phone, fat rims and a Kenwood Quick to get around it, and then I'll have it drop Simply cause I'm ridin' people think I'm sellin' rocks But ain't no future in your frontin' Yo Flash man, drop that, man Won't you drop that (Keep on) (To the beat ch'all) Cruel to the rules of the world Live my life raw, cause I never liked the law Wear top tens, on my ass use jeans Sellin' big 8ths and tit-for-tat to the fiends Clock much dollars, but I never break a sweat Time to move out, my posse sayin' (bet) You got my back, and I got yours What time is it? Hm, Tear down the doors Man There ain't no future in your frontin' Never was, cuz There ain't no future in your frontin' Hey man, let's start this party up, right?(Beat y'all) (Keep on)",MC Breed & DFC
00S35gEf40z03JTJgvQMqi,It's You - Radio Edit,Syn Cole,"Paints like a picture, sings like a melody Law of attraction feels like chemistry Yeah, it's a jungle out in the street You gotta fight for the things you need Every direction is lost to fate Somewhere they swear it changes I know it's you All of the emotion hit me in the moment I know it's you Every missed connection somehow was a blessing I know it's you Paints like a picture, sings like a melody Law of attraction feels like chemistry Yeah, it's a jungle out in the street You gotta fight for the things you need Every direction is lost to fate Somewhere they swear it changes I know it's you All of the emotion hit me in the moment I know it's you Every missed connection somehow was a blessing I know it's you",It's You
00SmB7n85SKROGjybsyq5i,Bongo Bong,Manu Chao,"Mama was queen of the mambo Papa was king of the Congo Deep down in the jungle I start bangin' my first bongo Every monkey'd like to be In my place instead of me 'Cause I'm the king of bongo, baby I'm the king of bongo bong I went to the big town Where there is a lot of sound From the jungle to the city Looking for a bigger crown So I play my boogie For the people of big city But they don't go crazy When I'm bangin' on my boogie I'm the (King  kthe bongo, king of the bongo bong Hear me when I come, baby King of the bongo King of the bongo bong Nobo Dy'd like to be in my place instead of me 'Cause nobody go crazy when I'm bangin' on my boogie I'm a king without a crown hanging loose in a big town But I'm the king of bongo baby I'm the king of bongo bong King of the bongo King of the bongo bong Hear me when I come, baby King of the bongo King of the bongo bong Hear me when I come They say that I'm a clown Making too much dirty sound They say there is no place for little monkey in this town Nobody'd like to be in my place instead of me 'Cause nobody go crazy when I'm bangin' on my boogie I'm the (King  kthe bongo, king of the bongo bong) Hear me when I come, baby King of the bongo King of the bongo bong Hear me when I come Bangin' on my bongo, all that swing belongs to me I'm so happy there's nobody in my place instead of me I'm a king without a crown hanging loose in a big town I'm the king of bongo baby I'm the king of bongo bong King of the bongo King of the bongo bong) Hear me when I come, baby (king of the bongo, king of the bongo bong Hear me when I come Mama was queen of the mambo Papa was king of the Congo Deep down in the jungle I start bangin' my first bongo Every monkey'd like to be In my place instead of me Cause I'm the king of bongo, baby I'm the king of bongo bong Hear me when I come Je ne t'aime plus mon amour Je ne t'aime plus tous les jours Je ne t'aime plus mon amour Je ne t'aime plus tous les jours Parfois j'aimerais mourir, tellement j'ai voulu croire Parfois j'aimerais mourir, pour ne plus rien avoir Parfois j'aimerais mourir, pour plus jamais te voir Parfois j'aimerais mourir, tellement y'a plus d'espoir Parfois j'aimerais mourir, pour plus jamais te revoir Parfois j'aimerais mourir, pour ne plus rien savoir Je ne t'aime plus mon amour Je ne t'aime plus tous les jours Je ne t'aime plus mon amour Je ne t'aime plus tous les jours",Clandestino
00UpV14MDfk4CvrMbFvqji,It Won't Stop (feat. Chris Brown) - Julian Calor Remix,Sevyn Streeter,"I love when you pulling up in your jeep Pumping all your beats J's on, with your shades on Just to bring me something to eat You the man up in these streets But when it comes to my heart That don't mean a thing no Baby, hop up in my ride Ooh, it's hot as hell outside Got the top down With the doors closed Put your hand on my thigh Drive slow ooh Take your time Every little thing you do, got me feeling some type of way (way) When you gimme that thunder you make my summer rain (Oh-oh-oh oh oh, Oh-oh-oh oh oh) Everyday, everyday And it won't stop Boom, boom, booooomm And it won't stop Boom, boom, boooooomm Yeah With every single part of me My love for you is constantly Forever and ever on repeat On repeat And it won't stop Boom, boom, boommmm I love when we pulling up to the beach, sand down in my feet Sun down, nobody around, that's one hell of a scene You rockin my body, rock, rock the boat, Aaliy-ah Don't it sound famil-ar, cause it feels like (ah, ah, aye, aye) Lookin' up in spaace, just me and my babe And it feels so amaazing, oh, oh all night Every little thing you do, got me feeling some type of way (way) When you gimme that thunder you make my summer rain (Oh-oh-oh oh oh, Oh-oh-oh oh oh) Everyday, everyday And it won't stop Boom, boom, booooomm And it won't stop Boom, boom, boooooomm Yeah With every single part of me My love for you is constantly Forever and ever on repeat On repeat And it won't stop Boom, boom, boommmm Everyday, Everyday I can't breathe You take my breath Away from me Heres my heart You got the key Put that on eternity I love you til infinity Infinity, infinity Infinity, infinity My everything, my everything And when I think about it be making me weak baby It won't ever stop My heart won't skip a beat baby And it'll keep going on, going on, going on And it won't stop Boom, boom, booooomm And it won't stop Boom, boom, boooooomm Yeah With every single part of me My love for you is constantly Forever and ever on repeat On repeat And it won't stop Boom, boom, boommmm",Atlantic Records Miami 2014
00WIXhVVhswHuS6dlkScuw,Hot,Confetti,"(Yeah) I'm the new truth, the crypto Erry'body peep the info Look how I switch the zip code The bed rock, flip the flintstones You like the way i move my body Take control, illuminati I'm the baddest at the party fo' sho' I'm like the drink that you been sippin' I'm the spice that you been missin' Good as gold baby I'm ready to go Oh baby, take a look at me Oh baby, do you like what you see? Oh baby, take a look at me 'Cuz I'm the hottest motherfucka' that you ever seen Do you like it? (hot, hot) Do you like it? (hot, hot) Do you like it? (hot, hot) Do you like it? If you want cake, then get some If you wanna break the system The fatboy slim at the disco The hips gonna speed the tempo You like the way i move my body Take control, illuminati I'm the baddest at the party fo' sho' I'm like the drink that you been sippin' I'm the spice that you been missin' Good as gold baby I'm ready to go How that body do so much lovin' It's gotta be good for something How that body do so much lovin' I got the touch so custom Oh baby, take a look at me Oh baby, do you like what you see? Oh baby, take a look at me 'Cuz I'm the hottest motherfucka' that you ever seen Do you like it? (hot, hot) Do you like it? (hot, hot) Do you like it? (hot, hot) Do you like it? (Do you like it?) Oh baby take a look at me 'Cuz I'm the hottest motherfucka' that you ever seen Do you like it? (hot, hot) Do you like it? (hot, hot) Do you like it? (hot, hot) Do you like it? (Yeah) I'm the new truth, the crypto Erry'body peep the info Look how I switch the zip code The bed rock, flip the flintstones You like the way i move my body Take control, illuminati I'm the baddest at the party fo' sho' I'm like the drink that you been sippin' I'm the spice that you been missin' Good as gold baby I'm ready to go Oh baby, take a look at me Oh baby, do you like what you see? Oh baby, take a look at me 'Cuz I'm the hottest motherfucka' that you ever seen Do you like it? (hot, hot) Do you like it? (hot, hot) Do you like it? (hot, hot) Do you like it? If you want cake, then get some If you wanna break the system The fatboy slim at the disco The hips gonna speed the tempo You like the way i move my body Take control, illuminati I'm the baddest at the party fo' sho' I'm like the drink that you been sippin' I'm the spice that you been missin' Good as gold baby I'm ready to go How that body do so much lovin' It's gotta be good for something How that body do so much lovin' I got the touch so custom Oh baby, take a look at me Oh baby, do you like what you see? Oh baby, take a look at me 'Cuz I'm the hottest motherfucka' that you ever seen Do you like it? (hot, hot) Do you like it? (hot, hot) Do you like it? (hot, hot) Do you like it? (Do you like it?) Oh baby take a look at me 'Cuz I'm the hottest motherfucka' that you ever seen Do you like it? (hot, hot) Do you like it? (hot, hot) Do you like it? (hot, hot) Do you like it?",Hot
00YeYHw6zhoy1y7EPTgIkj,Shine - Kygo Remix,Benjamin Francis Leftwich,"I could live in a different place With a different house and a different name I could sing you your favorite song Yeah, you'd sing along, you'd sing along I could wrap you in your favorite clothes And kiss your face just so you know That I'm the one who has got your back Now turn around and don't be sad I hope you find the love that's true So the morning light can shine on you I hope you find what you're looking for So your heart is warm forever more I could fly you away with me To the furthest place you'll ever be We could smoke 'til the sun goes down And without a sound, without a sound We'd fall asleep by the big blue sea With open eyes so we could see The way it shines for you and I You know it'll shine until we fly I hope you find the love that's true So the morning light can shine on you I hope you find what you're looking for So your heart is warm forever more I could wait with you by the water I could wait with you for the winter to come I could stand with you with your snow boots on I hope you find the love that's true So the morning light can shine on you I hope you find what you're looking for So your heart is warm forever more I hope you find what you're looking for So your heart is warm forever more",Shine (Kygo Remix)
00Z0GIRi0l7WqQnQJCo5S2,Don't Let It Break Your Heart - Single Edit,Louis Tomlinson,"On our way to Twenty Seven Got a place on the other side of London Doing better, doing better And I know you left a part of you In New York under your bed in a box But you're doing better, doing better Life gets hard and it gets messed up When you give so much, but it's not enough When the high's too high and the low's too low When you love someone and they let you go Don't you let it kill you Even when it hurts like hell Oh, whatever tears you apart Don't let it break your heart Time takes time to heal it You can't do it by yourself Oh, whatever tears you apart Don't let it break your heart It comes, it goes We're driving down a one-way road To something better, something better What hurts you is gonna pass and You'll have learnt from it when it comes back You'll be doing better, yeah, doing better 'Cause life gets hard and it gets messed up When you give so much, but it's not enough When the high's too high and the low's too low When you love someone and they let you go Don't you let it kill you Even when it hurts like hell Oh, whatever tears you apart Don't let it break your heart Time takes time to heal it You can't do it by yourself Oh, whatever tears you apart Don't let it break your heart (Oh) (Oh) (Oh) Don't let it break your heart 'Cause life gets hard and it gets messed up When you give so much and it's not enough When the high's too high and the low's too low When you love someone and they let you go Don't you let it kill you Even when it hurts like hell Oh, whatever tears you apart Don't let it break your heart Time takes time to heal it You can't do it by yourself Oh, whatever tears you apart Don't let it break your heart Don't let it break your heart (Oh) Don't let it break your heart (Oh) Don't let it break your heart (Oh) Don't let it break your heart (Oh, don't let it break your heart) Don't let it break your heart (Oh, oh, don't let it) Don't let it break your heart (Oh, break your heart, no, no) Don't let it break your heart (Oh) Don't let it break your heart (Oh, don't let it break your heart)",Don't Let It Break Your Heart
011gUcrvLDn2gEApOdOhVe,Been A While,Sam Feldt,"It's been a while Since I let you Cross my mind I can let you run How could I let you go? Haven't seen you 'round here for a while How could I let you go? Haven't seen you naked for a while It's been a while Since I let you Drive around I could choose you, lover How could I let you go? Haven't seen you 'round here for a while How could I let you go? Haven't seen you naked for a while Haven't seen you 'round here for a while Haven't seen you naked for a while",Been A While
012mGdSYIBEmERuScm2iOl,Santa Claus Is Coming To Town,The Jackson 5,"Santa Claus is comin' to town Santa Claus is comin' to town You'd better watch out You'd better not cry You'd better not pout I'm telling you why Santa Claus is comin' to town Santa Claus is comin' to town Santa Claus is comin' to town He's making a list And checking it twice Gonna find out who's naughty and nice Santa Claus is comin' to town, oh yeah Santa Claus is comin' to town Santa Claus is comin' to town He sees you when you're sleeping He knows when you're awake He knows if you've been bad or good So be good for goodness sake (Be good for goodness sake) Oh, you'd better watch out (Watch out) You'd better not cry (Woo hoo) Better not pout I'm telling you why Oh! Santa Claus is comin' to town, oh yeah Santa Claus is comin' to town Santa Claus is comin' to town (Woo hoo) (Woo hoo...woo hoo) Santa Claus is comin' to town Santa Claus is comin' to town Santa Claus is comin' to town Little tin horns, and little toy drums Rooty-toot-toot, and rump-a-tum-tums Curly-haired dolls, that tootle and coo Elephants, boats, and kiddie cars too Oh! Santa Claus is comin' to town, oh yeah Santa Claus is comin' to town Santa Claus is comin' to town One more time now Santa Claus is comin' to town, oh yeah Santa Claus is comin' to town Santa Claus is comin' to town",Christmas Number 1's
014J7jX1wSv0manSdRnveo,Dancing On My Own - Tiësto Remix,Calum Scott,"Somebody said you got a new friend But does she love you better than I can? And there's a big black sky over my town I know where you're at, I bet she's around And yeah I know it's stupid, but I just gotta see it for myself I'm in the corner, watching you kiss her, oh oh oh And I'm right over here, why can't you see me? Oh oh oh And I'm giving it my all But I'm not the guy you're taking home, oooh I keep dancing on my own I just wanna dance all night And I'm all messed up, I'm so out of line, yeah Stilettos and broken bottles I'm spinning around in circles And I'm in the corner, watching you kiss her, oh oh oh And I'm right over here, why can't you see me? Oh oh oh And I'm giving it my all But I'm not the guy you're taking home, ooh I keep dancing on my own And oh, nah So far away, but still so near The lights come on, the music dies But you don't see me standing here I just came to say goodbye I'm in the corner, watching you kiss her, ohh And I'm giving it my all But I'm not the guy you're taking home, oooh I keep dancing on my own And oh, nah Said I'm in the corner, watching you kiss her, oh​ no And I'm right over here, why can't you see me? Oh no And I'm giving it my all But I'm not the guy you're taking home, ooh And I keep dancing on my own So far away, but still so near The lights come on, the music dies But you don't see me standing here",Dancing On My Own (Tiësto Remix)
