track_id,track_name,track_artist,lyrics,track_album_name
01R0Xdwje645C6xFCnMRvm,Talk Dirty To Me,Poison,"You know I never I never seen you look so good You never act the way you should But I like it And I know you like it too The way that I want you I gotta have you Oh yes, I do I never I never ever stay out late You know that I can hardly wait Just to see you And I know you cannot wait A' Wait to see me too I gotta touch you Cause baby we'll be At the drive-in In the old man's Ford Behind the bushes Till I'm screaming for more Down the basement Lock the cellar door And baby Talk dirty to me You know I call you I call you on the telephone I'm only hoping that you're home So I can hear you When you say those words to me And whisper so softly I gotta hear you Cause baby we'll be At the drive-in In the old man's Ford Behind the bushes Till I'm screaming for more Down the basement Lock the cellar door And baby Talk dirty to me C.C. pick up that guitar and talk to me Cause baby we'll be At the drive-in In the old man's Ford Behind the bushes Till I'm screaming for more Down the basement Lock the cellar door And baby Talk dirty to me Cause baby we'll be At the drive-in In the old man's Ford Behind the bushes Till I'm screaming for more Down the basement Lock the cellar door And baby Talk dirty to me You know I never I never seen you look so good You never act the way you should But I like it And I know you like it too The way that I want you I gotta have you Oh yes, I do I never I never ever stay out late You know that I can hardly wait Just to see you And I know you cannot wait A' Wait to see me too I gotta touch you Cause baby we'll be At the drive-in In the old man's Ford Behind the bushes Till I'm screaming for more Down the basement Lock the cellar door And baby Talk dirty to me You know I call you I call you on the telephone I'm only hoping that you're home So I can hear you When you say those words to me And whisper so softly I gotta hear you Cause baby we'll be At the drive-in In the old man's Ford Behind the bushes Till I'm screaming for more Down the basement Lock the cellar door And baby Talk dirty to me C.C. pick up that guitar and talk to me Cause baby we'll be At the drive-in In the old man's Ford Behind the bushes Till I'm screaming for more Down the basement Lock the cellar door And baby Talk dirty to me Cause baby we'll be At the drive-in In the old man's Ford Behind the bushes Till I'm screaming for more Down the basement Lock the cellar door And baby Talk dirty to me",Look What The Cat Dragged In
01TzbTwZ9Mce9mOeBpH03i,Goodbye Love,Guy,"(Baby, don't go) No baby, no baby, no baby No No baby, no baby, no baby (No, no, no, no, no, no, no, no, no, no Don't wanna go) Even though I hate to leave girl For I cry as I walk out the door (The door, I cry) Temptation is asking me to stay But we've been through the same thing before I can't believe that this is happening to us We made vows to never be apart (Never, never, never, never) I turn my head to see if you're hurt 'Cause I also feel it deep in my heart You said you'd never leave me I said I'll never leave you But fairy tales don't always come true You promised to stay with me I promised to stay with you I guess you knew and blew a good thing, baby 'Cause I'm saying bye bye My sunny days just ain't the same Every hour of the day brings me tears (I cry, too) So I guess I have to keep on hoping, wishing, praying That you are here (That you're here with me yeah) And I'd rather end this self misery than to go on Living without you And, and,  I I ask myself over and over again If leaving you makes me a fool Baby You said you'd never leave me I said I'll never leave you But fairy tales don't always come true You promised to stay with me I promised to stay with you I guess you knew, I guess you knew we blew a good thing Yeah, yeah 'Cause I'm saying bye bye Bye bye (Goodbye love) You know I'm saying bye bye (Goodbye love) Bye bye (Goodbye) Bye bye, my love, yeah What must I do If I can't spend this moment with you I'm out of mind Just help me to regain my sanity, baby Bye bye, baby Bye bye (Goodbye love) I don't really want to leave you baby I am so confused, baby (Goodbye) Good, good, goodbye baby (Goodbye love) Don't leave me baby 'Til we make love just one more time Make it seem forever This is our last and final goodbye Goodbye",Guy
01vv2AjxgP4uUyb8waYO5Y,Morph,Twenty One Pilots,"Move! Can't stop thinking about if and when I die For now I see that ""if"" and ""when"" are truly different cries For ""if"" is purely panic and ""when"" is solemn sorrow And one invades today while the other spies tomorrow We're surrounded and we're hounded There's no above, or under, or around it For ""above"" is blind belief and ""under"" is sword to sleeve And ""around"" is scientific miracle, let's pick ""above"" and see For if and when we go above, the question still remains Are we still in love and is it possible we feel the same? And that's when goin' under starts to take my wonder But until that time, I'll try to sing this If I keep moving, they won't know I'll morph to someone else What they throw at me's too slow I'll morph to someone else I'm just a ghost I'll morph to someone else A defense mechanism mode He'll always try to stop me, that Nicolas Bourbaki He's got no friends close but those who know him most know He goes by Nico, he told me I'm a copy When I'd hear him mock me, that's almost stopped me Well, we're surrounded and we're hounded There's no above or a secret door What are we here for If not to run straight through all our tormentors? But until that time, I'll try to sing this If I keep moving, they won't know I'll morph to someone else What they throw at me's too slow I'll morph to someone else I'm just a ghost I'll morph to someone else A defense mechanism mode I'll morph to someone else Lights, they blink to me, transmitting things to me Ones and zeroes, ergo this symphony Anybody listening? Ones and zeroes Count to infinity, ones and zeroes I'm surrounded and I'm hounded There's no above, or under, or around it For ""above"" is blind belief and ""under"" is sword to sleeve And ""around"" is scientific miracle, let's pick ""above"" and see For if and when we go above, the question still remains Are we still in love and is it possible we feel the same? And that's when goin' under starts to take my wonder But until that time I'll morph to someone else I'm just a ghost If I keep moving, they won't know I'll morph to someone else What they throw at me's too slow I'll morph to someone else I'm just a ghost I'll morph to someone else A defense mechanism mode If I keep moving, they won't know I'll morph to someone else A defense mechanism mode I'll morph to someone else Not done, not done Not done, Josh DunI'll morph to someone else",Trench
01XFgRZfZI7oBagNf1Loml,Harlem Shake,Baauer,"Con los terroristas, -tas, -tas, -tas -tas -tas -tas -tas, -tas -tas -tas -tas -tas Then do the Harlem Shake (Shake!) Ey (Shake!), con los terroristas Ey (Shake!), ey (Shake!) Ey (Shake!), ey (Shake!) Ey (Shake!), ey (Shake!) (Shake!) -tas, (Shake!) -tas, -tas, (Shake!) -tas, -tas, -tas, -tas -tas, -tas, (Shake!) -tas, -tas, (Shake!) -tas, -tas, -tas, -tas -tas, -tas, -tas, -tas, -tas -tas -tas -tas -tas -tas -tas -tas -tas Then do the Harlem Shake (Shake!) Ey (Shake!), con los terroristas Ey, (Shake!) ey (Shake!) Shake, shake Shake, ey (Shake!) Ey (Shake!), ey (Shake!) Ey (Shake!)",Harlem Shake
020mPSviVz90DTlyfxofDJ,Always Gonna Say Sorry,Joakim Molitor,"I always say sorry But that word don't mean nothin' Go world, go away, hurry There's no way I can change Run away baby You always say somethin' Tryna lead my way but it's Just way too late so ya Wastin' time bein' mine Go your own way Why don't you just say it babe Say it to my face No, I don't feel ashamed When you look at me the way No, I'm never gonna change, sorry There's no point in tryna pretend Oh it's just not worth it no longer Fall back and I'll do it again Then I'm always gonna say sorry Then I'm always gonna say sorry It don't make sense, does it To try again 'Cuz this Feels like the end For us No more games Have to play Let's just be honest Why don't you just say it babe Say it to my face No, I don't feel ashamed When you look at me the way No, I'm never gonna change, sorry There's no point in tryna pretend Oh it's just not worth it no longer Fall back and I'll do it again Then I'm always gonna say sorry Then I'm always gonna say sorry There's no point in tryna pretend Oh it's just not worth it no longer Fall back and I'll do it again And I'm always gonna say sorry There's no point in tryna pretend Oh it's just not worth it no longer Fall back and I'll do it again Then I'm always gonna say sorry Then I'm always gonna say sorry",Always Gonna Say Sorry (feat. Maia Wright)
02138lFv3Bzncr6ScNbLAF,Rattle Your Cage,Skrizzly Adams,"Well I know you've been talking somebody When you said, you're never gonna slip up again, yea And I know it ain't like me to say I'm sorry, yea But I guess I went and fucked up again (I guess I did cause) Well I know that you want it, you want it And it's right here at your front door screaming out Well I wanna rattle your cage I wanna make you sweat I wanna do it all over and over and over and over again Well I wanna rattle your cage Well I know that you're gonna do what you do cause you don't know nothing else When you say, that ya just can't, yea you just can't walk away It ain't fair, but you're gonna break what you break cause you don't do nothing else So I guess, I gotta just stand up and walk (And come back singing) Well I know that you want it, you want it, yea When you said that you just don't care anymore But you know that I've got it, I've it it And it's right here at your front door screaming out Well I wanna rattle your cage I wanna make you sweat I wanna do it all over and over and over and over again Well I wanna rattle your cage Well I think that you're crazy baby and everything's gone maybe later and you're just gonna take it lady, cause I've got something to say Well I wanna rattle your cage Well I wanna make you sweat, yea I wanna do you all over and over and over and over again Well I wanna Cause everything lately, got me goin crazy, I could be your man yea you could be my baby You don't have to save me, this ain't gonna break me, even take and you shake what you want Cause everything lately, got me goin crazy, I could be your man yea you could be my baby You don't have to save me, this ain't gonna break me, even take I wanna rattle your cage Well I know you've been talking somebody When you said, you're never gonna slip up again, yea And I know it ain't like me to say I'm sorry, yea But I guess I went and fucked up again (I guess I did cause) Well I know that you want it, you want it And it's right here at your front door screaming out Well I wanna rattle your cage I wanna make you sweat I wanna do it all over and over and over and over again Well I wanna rattle your cage Well I know that you're gonna do what you do cause you don't know nothing else When you say, that ya just can't, yea you just can't walk away It ain't fair, but you're gonna break what you break cause you don't do nothing else So I guess, I gotta just stand up and walk (And come back singing) Well I know that you want it, you want it, yea When you said that you just don't care anymore But you know that I've got it, I've it it And it's right here at your front door screaming out Well I wanna rattle your cage I wanna make you sweat I wanna do it all over and over and over and over again Well I wanna rattle your cage Well I think that you're crazy baby and everything's gone maybe later and you're just gonna take it lady, cause I've got something to say Well I wanna rattle your cage Well I wanna make you sweat, yea I wanna do you all over and over and over and over again Well I wanna Cause everything lately, got me goin crazy, I could be your man yea you could be my baby You don't have to save me, this ain't gonna break me, even take and you shake what you want Cause everything lately, got me goin crazy, I could be your man yea you could be my baby You don't have to save me, this ain't gonna break me, even take I wanna rattle your cage",Young Man
023OVLNzXhX0j7CxswUt6D,Cheerleader - Felix Jaehn Remix Radio Edit,OMI,"Kid Ink, egh I think I found a genie in a bottle baby, with a bottle shape And she don't have no problem representing for the team Ok it's feeling like I just hit the lotto, baby 32-26-34, wasted Watch her do a dance then it get me in the game Going hard in the paint what's my name what's my name girl You know, I be missing that bom-bom when I'm away I swear, when you shaking them pom-poms all I can say is Oh I think that I found myself a cheerleader She is always right there when I need her Oh I think that I found myself a cheerleader She is always right there when I need her When I need motivation My one solution is my queen Cause she' stay strong (yeah yeah) She is always in my corner Right there when I want her All these other girls are tempting But I'm empty when you're gone And they say Do you need me Do you think I'm pretty Do I make you feel like cheating? And I'm like no, not really cause Oh I think that I found myself a cheerleader She is always right there when I need her Oh I think that I found myself a cheerleader She is always right there when I need her Ahh, I need her, right here where she need to be Complimenting my style you're flyer with the Captain of the team Now move, right, right there, hit reverse girl and back that rear Roll it with me and then light that up and the rest is history write that, book My cheerleader, something about her demeanor Even though I'm off these margaritas can't none of these hoes here come between us Shorty no regular chick, so I just take her to places she ain't know exist So she never forget, who the man is She gives me love and affection Baby did I mention, you're the only girl for me No I don't need a next one Mama loves you too, she thinks I made the right selection Now all that's left to do Is just for me to pop the question Oh I think that I found myself a cheerleader She is always right there when I need her Oh I think that I found myself a cheerleader She is always right there when I need her I need,right right there I need,right right there I need,right right there Right right there",Me 4 U
027h5P3kCyktHv9dpHUBBS,Why Don't You Get A Job,The Offspring,"My friend's got a girlfriend Man, he hates that bitch He tells me every day He says, ""Man, I really gotta lose my chick In the worst kind of way."" She sits on her ass He works his hands to the bone To give her money every payday But she wants more dinero just to stay at home Well, my friend, you gotta say ""I won't pay, I won't pay ya, no way Na-na, why don't you get a job?""Say, ""No way,"" say, ""No way-ya, no way Na-na, why don't you get a job?"" I guess all his money, well, it isn't enough To keep her bill collectors at bay I guess all his money, well, it isn't enough 'Cause that girl's got expensive taste ""I won't pay, I won't pay ya, no way Na-na, why don't you get a job?"" Say, ""No way,"" say, ""No way-ya, no way Na-na, why don't you get a job?"" Well, I guess it ain't easy doing nothing at all But hey man, free rides just don't come along Every day Let me tell you about my other friend now My friend's got a boyfriend Man, she hates that dick She tells me every day He wants more dinero just to stay at home Well, my friend, you gotta say ""I won't pay, I won't pay ya, no way Na-na, why don't you get a job?"" Say, ""No way,"" say, ""No way-ya, no way Na-na, why don't you get a job?"" ""I won't give you no money, I always pay Na-na, why don't you get a job?"" Say, ""No way,"" say, ""No way-ya, no way Na-na, why don't you get a job?"" Hey! That's something everyone can enjoy",Americana
027VSEVC8RRjUXLEJAzhH6,On the Back of Your Neck,Cienfue,"Fighting through the crowd and my heart is beating loud and the wolves The sky is full of dark clouds, breathing black CO2 Wolf is howling at the moon, lightning in the little spoon Beyond a shadow of a doubt gonna make you scream and shout Yeah yeah, yeah yeah Make the hairs stand up on the back of your neck, on the back of your neck Gonna make the hairs stand up on the back of your neck, on the back of your neck I wanna find the dark side of the moon tonight I wanna light a thousand fireflies in the night Deer is in the headlight, fight or flight is alright Blinded by the bright lights, we just wanna take our vows Yeah yeah, yeah yeah Make the hairs stand up on the back of your neck, on the back of your neck Gonna make the hairs stand up on the back of your neck, on the back of your neck I wanna find the dark side of the moon tonight I wanna light a thousand fireflies in the night Wolf is howling at the moon, lightning in the little spoon Beyond a shadow of a doubt gonna make you scream and shout Yeah yeah, yeah yeah Make the hairs stand up on the back of your neck, on the back of your neck Gonna make the hairs stand up on the back of your neck, on the back of your neck Make the hairs stand up on the back of your neck, on the back of your neck Gonna make the hairs stand up on the back of your neck, on the back of your neck",On the Back of Your Neck
02803el8p3mKqcJzJ3Agpp,WhatWasThat,BONES,"Okay, you can get it, not offended, not a problem Cause every single one that came my way You know I solved 'em I keep my phone dead Still, they hit me, still they calling' I take just what I need Dropping and mix it in the cauldron Drop (Drop) Let it drop on they ass Every shadow of the past Blow away with the ash Never stop (stop) You can never get a pass Step away from the trash If you come in, you gon' get that ass stomped (Stomped) I reside under the bridge Where the dead come to live Two stroke coated ribs get whomped (whomped) Dirty rag to the mouth You ain't know what we about Where the tracks and the route get dumped Remember the Trail behind Jonna's? We'd gather Corona's They empty of course And we bag ‘em And go just get us a quarter Of something that we thought was dope Fuck it though, fuck it though, roll it When it get bad, you will know it Wallow away in the same fucking place Just a person that hated that town that he came Fuck it though, fuck it though, roll it When it get bad, you will know it We paid a fee all we got was the faux All we wanted was fire and a blunt just to roll Am I lurking at your door? You don't really want to know Shut your eyes let it go Put your dreams in a boat Let it float You gonna know when I come in through the floor When the waves crash down and you wake up to a noise“What was that?” “What was that?” “What was that?” “What was that?” “What was that?” “What was that?” What Droppin' out the land where the map is your hand Point to the Palm area, and then they understand Droppin' out the land where the map is your hand Point to the Palm area, and then they understand",HermitOFEastGrandRiver
028JxheELfIvvY4zBXuMjw,Heartless (feat. Mustard),Polo G,"Mustard on the beat, ho My youngin's heartless so they ain't playin' no games We really want 'em dead, he got hit up close range He fucked up in the head, he wanna see some mo' brains On that corner I can't stay up out that dope gang My cousin got indicted dealing cocaine She an Instagram addict, she want mo' fame I used to starve, now I'm blowing up like propane Told my inner-self, ""I promise you I won't change"" We make it hot up on yo block, we let that heat blow Catch an opp, we dump the clip, it's time to reload Put a scope on the AR just like a peep-hole Think he a bully, we got choppers for the Deebo Seven-figure nigga, tryna maximize them three o'sBefore the bag, I was fucking all the freak hoes Balling hard, young legend out the Chi' bitch, I'm like D. Rose""Cap, how you make it out this shit?"", I got the cheat code Way more to life then just the hood, I'm trying to reach goals Maxine, my heart, since you've been gone, I miss your sweet soul Ayy, never tell a statement, we won't leak those Better not go talkin' to them people, better keep closed My youngin's heartless so they ain't playin' no games We really want 'em dead, he got hit up close range He fucked up in the head, he wanna see some mo' brains On that corner I can't stay up out that dope gang My cousin got indicted dealing cocaine She an Instagram addict, she want mo' fame I used to starve, now I'm blowing up like propane Told my inner-self, ""I promise you I won't change"" We hold a grudge and we want blood, we can't look past the issue Play with us then and you gon' die, nigga, it's kinda simple Show no mercy, we gon' kill whoever riding with you Catch you on the other side then we gon' have to get you Condolences to yo family, they gon' have to miss you Lil Joe on go and he gon' spark, that's if I pass the signal My right hand mans, he got his name 'cause he gon' blast the pistol Earned our stripes, we gon' blow if a nigga play foul You would think we had a whistle Lil Cap-a-lot, G-O-A-T, yeah that's that guy's initials Happiness and depression, I'm stuck inside the middle I fell in love with dollar signs, won't let my mind forget you Fuck it off, we spend it all on fast cars, and shining crystals My youngin's heartless so they ain't playin' no games We really want 'em dead, he got hit up close range He fucked up in the head, he wanna see some mo' brains On that corner I can't stay up out that dope gang My cousin got indicted dealing cocaine She an Instagram addict, she want mo' fame I used to starve, now I'm blowing up like propane Told my inner-self, ""I promise you I won't change""",Heartless (feat. Mustard)
029QP3fFtLaW9B9RKr8DAg,Say My Name,Lil Yachty,"I want you to say my name, say my name Say my, say my name, say my name right now I want you to say my name, say my name Say my, say my name, baby, say my name, baby say my name loud I want you to say my name, say my name Say my, say my name, say my name in the crowd I want you to say my name, say my name Say my, say my name, baby, say my name, loud I'm about to kill this scene Got a Billie Jean by my side And my wrist on bling blaow I got pictures in the magazine Gettin' chauffeured 'round While my bad bitch smokin' on loud If you had seen half the shit I've seen You would prolly fiend, for a taste, for a taste of the clout Always number 9 on a nigga jeans Gang, gang so deep walkin' 'round like I'm walkin' with the crowd Uh, I want you to say my name, say my, say my name Say my name, say my, say my name, say my name now I want you to say my, say my name, say my name Say my, say my name, say my name, say my name loud I want you to say my, say my, say my name, say my name Say my, say my name, say my name in the crowd I want you to say my, say my name, say my name Say my, say my name, say my name right now Say my name now Say my name loud Every time I wake up, I read silly things Internet tryna take a nigga, take a nigga out his clout All these bitches hatin' on a nigga dreams Tryna make sure they do anything to make sure that I fail I just hit a lick on the runway I'll be back before Sunday Gotta get this money now My brother used to sleep in a Hyundai Now he spent about a hundred G's on a fun day, wow And just when I thought about giving up I got slapped in the face with a blessing slap like pow And fresh as hell on my bum day I look fresher than a nigga do on their b-day, wow I want you to say my name, say my, say my name Say my name, say my, say my name, say my name now I want you to say my, say my name, say my name Say my, say my name, say my name, say my name loud I want you to say my, say my name, say my name Say my, say my name, say my name in the crowd I want you to say my, say my name, say my name Say my, say my name, say my name right now",Teenage Emotions
02AT1Z0nscuElXMWBEzEKu,Paint My Love - 2014 Remastered Version,Michael Learns To Rock,"From my youngest years Till this moment here I've never seen Such a lovely queen From the skies above To the deepest love I've never felt Crazy like this before Paint my love You should Paint my love It's the picture of A thousand sunsets It's the freedom of A thousand doves Baby you should Paint my love Been around the world Then I met you girl It's like coming home To a place I've known Paint my love You should Paint my love It's the picture of A thousand sunsets It's the freedom of A thousand doves Baby you should Paint my love Since you came Into my life The days before all fade To black and white Since you came Into my life (Ooh, into my life) Everything has changed (Ooh) Paint my love You should Paint my love It's the picture of A thousand sunsets It's the freedom of A thousand doves Baby you should Paint my love (Paint my love) Paint my love You should Paint my love It's the picture of A thousand sunsets (It's the picture of) It's the freedom of (Ooh) A thousand doves Baby you should Paint my love Ooh",25
